{
  "schema": 1,
  "id": "zimbabwe-rhodesia-1891",
  "kind": "presence",
  "status": "active",
  "supersededBy": null,
  "aliases": [],
  "authors": [
    {
      "name": "CShapes 2.0 import (tools/import/cshapes.mjs)",
      "github": null
    }
  ],
  "license": "CC-BY-NC-SA-4.0",
  "created": "2026-09-02",
  "revised": null,
  "sources": [
    {
      "source": "cshapes-2-0",
      "locator": "fid 398"
    }
  ],
  "actor": "zimbabwe-rhodesia",
  "presenceType": "state",
  "dependencyOf": "united-kingdom",
  "dependencyKind": "colony",
  "when": {
    "start": 1891,
    "end": 1900,
    "date": "1891-06-11",
    "endDate": "1900-01-28"
  },
  "geometry": {
    "files": [
      "geo/presences/1886-1913.json"
    ],
    "key": "398"
  },
  "capital": {
    "lon": 31.04472,
    "lat": -17.81778,
    "precision": "city",
    "label": "Harare"
  },
  "confidence": "consensus"
}
